,Code,Description,Airport,City,State,lat,lon,latlon,City_State
298,15096,"Syracuse, NY: Syracuse Hancock International",Syracuse Hancock International,Syracuse,NY,43.1139301,-76.1101888,"(43.113930100000005, -76.110188799999989)",Syracuse (NY)
299,15249,"Tallahassee, FL: Tallahassee International",Tallahassee International,Tallahassee,FL,30.395743,-84.345124,"(30.395743, -84.345123999999998)",Tallahassee (FL)
300,15295,"Toledo, OH: Toledo Express",Toledo Express,Toledo,OH,41.5924755,-83.8060041,"(41.592475499999999, -83.806004099999996)",Toledo (OH)
301,15304,"Tampa, FL: Tampa International",Tampa International,Tampa,FL,27.9834776,-82.5370781,"(27.983477600000001, -82.537078100000002)",Tampa (FL)
302,15323,"Bristol/Johnson City/Kingsport, TN: Tri-Cities Regional TN/VA",Tri-Cities Regional TN/VA,Bristol/Johnson City/Kingsport,TN,36.48111,-82.40785,"(36.481110000000001, -82.407849999999996)",Bristol/Johnson City/Kingsport (TN)
303,15356,"Trenton, NJ: Trenton Mercer",Trenton Mercer,Trenton,NJ,40.277031,-74.8180489,"(40.277031000000001, -74.818048900000008)",Trenton (NJ)
304,15370,"Tulsa, OK: Tulsa International",Tulsa International,Tulsa,OK,36.198778,-95.8838659,"(36.198778000000004, -95.883865900000004)",Tulsa (OK)
305,15376,"Tucson, AZ: Tucson International",Tucson International,Tucson,AZ,32.1145102,-110.9392269,"(32.114510199999998, -110.93922690000001)",Tucson (AZ)
306,15380,"Traverse City, MI: Cherry Capital",Cherry Capital,Traverse City,MI,44.7369137,-85.5796208,"(44.736913700000002, -85.579620800000001)",Traverse City (MI)
307,15389,"Twin Falls, ID: Joslin Field - Magic Valley Regional",Joslin Field - Magic Valley Regional,Twin Falls,ID,42.5629668,-114.4608711,"(42.562966799999998, -114.46087109999999)",Twin Falls (ID)
308,15401,"Texarkana, AR: Texarkana Regional-Webb Field",Texarkana Regional-Webb Field,Texarkana,AR,33.4568777,-93.9941485,"(33.4568777, -93.994148499999994)",Texarkana (AR)
309,15411,"Tyler, TX: Tyler Pounds Regional",Tyler Pounds Regional,Tyler,TX,32.3511258,-95.4096293,"(32.351125800000005, -95.409629299999992)",Tyler (TX)
310,15412,"Knoxville, TN: McGhee Tyson",McGhee Tyson,Knoxville,TN,35.810833,-83.993889,"(35.810833000000002, -83.993888999999996)",Knoxville (TN)
311,15497,"St. Augustine, FL: Northeast Florida Regional",Northeast Florida Regional,St. Augustine,FL,29.9543518,-81.3429353,"(29.954351799999998, -81.342935299999994)",St. Augustine (FL)
312,15607,"Valdosta, GA: Valdosta Regional",Valdosta Regional,Valdosta,GA,30.785034,-83.27651,"(30.785034000000003, -83.276510000000002)",Valdosta (GA)
313,15624,"Valparaiso, FL: Eglin AFB Destin Fort Walton Beach",Eglin AFB Destin Fort Walton Beach,Valparaiso,FL,30.495438,-86.549817,"(30.495438, -86.549817000000004)",Valparaiso (FL)
314,15841,"Wrangell, AK: Wrangell Airport",Wrangell Airport,Wrangell,AK,56.4850237,-132.3795998,"(56.485023700000006, -132.37959979999999)",Wrangell (AK)
315,15897,"West Yellowstone, MT: Yellowstone",Yellowstone,West Yellowstone,MT,44.427963,-110.588455,"(44.427962999999998, -110.58845500000001)",West Yellowstone (MT)
316,15919,"Fayetteville, AR: Northwest Arkansas Regional",Northwest Arkansas Regional,Fayetteville,AR,36.2786587,-94.304294,"(36.278658700000008, -94.304293999999999)",Fayetteville (AR)
317,15991,"Yakutat, AK: Yakutat Airport",Yakutat Airport,Yakutat,AK,59.509167,-139.65973,"(59.509167000000005, -139.65973)",Yakutat (AK)
318,16218,"Yuma, AZ: Yuma MCAS/Yuma International",Yuma MCAS/Yuma International,Yuma,AZ,32.6926512,-114.6276916,"(32.6926512, -114.62769159999999)",Yuma (AZ)
